id_entree,nom,desc_entree,prix
1,Salade caesar,Mélange de salade; d'émincés de poulet roti; de fromage; de tomates cerices et de croûtons grillés.,6.00
2,Pain à l'ail - 6 pièces,De bonnes tartines beurées à l'ail et au percil.,4.50
3,Mozzarella Sticks - 8 pièces,Une panure croustillantes sur des batonnets de mozzarella.,4.50
4,Nuggets - 8 pièces,Des nuggets de poulet tendre et croustillants.,5.00
5,Chicken wings - 8 pièces,Des ailerons de poulet marinés et grillés.,5.00
6,Sauce aux choix,Accompagnez vos entrées par nos décileuses sauces maison.,0.30
